Index,DocID,PairID,Score,Text
2768,w_pp,w_pp_472,0.469,"Ben Hall 's body was taken back to Forbes where an official inquest was held .
An official inquest was held in the court house to find out how he died ."
2769,gr,gr_811,0.469,"She was another strong character, and a wonderful friend to Violet.
Wonderful second book in the Violet Eden Chapters."
2770,gr,gr_635,0.469,"Violet isn't one to go down without a fight thought.
I am hoping that whatever hold Phoenix has over Violet will go away."
2771,f_r,f_r_40,0.469,"it's not popular but maybe the tv channel's website that it comes in on
You can go on the TV Show's website to check their ratings."
2772,stance,stance_328,0.469,"@JebBush and @marcorubio cannot speak their minds b/c they are paid 2 keep things pc. @realDonaldTrump ANSWERS TO NO ONE!
@realDonaldTrump they may be dumping you now, but when you're president they'll be begging for your business."
2773,f_r,f_r_504,0.469,"Go to see the movie Memoirs of a Geisha, it is a beautiful movie.
Memoirs of a Geisha i wanna see it soooooo bad"
2774,stance,stance_644,0.469,"Fantastic Emmet County Dem meeting tonight in Estherville. Glad to meet some @HillaryClinton supporters!
If you need me I'll be screaming like a little baby from now until about ten minutes after @HillaryClinton arrives in #PTown."
2775,snli,snli_561,0.469,"A man is resting atop concrete structure in a crowded area.
Construction work being performed in a local business area."
2776,nmt_r,nmt_r_163,0.469,"Dinner that night became a ritual.
How about dinner at my place tomorrow?"
2777,nmt_r,nmt_r_38,0.469,"He's just down the hall.
The bathroom's down the hall and to the left."
2778,f_r,f_r_439,0.469,"I am an Aquarius, but thank you for the points.
I was unaware of that. Thank you for the two points."
2779,stance,stance_290,0.469,"When is abortion a responsible choice? When a woman chooses it to be
It's so brilliant that #lovewins - now extend the equality to women's rights #abortionrights"
2780,stance,stance_178,0.469,"Hillary Clinton keeps sending me emails, and when I try to unsubscribe, I get an error message. THIS IS CANCER
@FoxNews @GovChristie @HillaryClinton Actually she should be disqualified from running!How many scams and ethics problems now?"
2781,w_r,w_r_104,0.469,"After another Tribal Council , things got worse for Ulong as they got lost in the dark on their way back to camp .
Koror won Immunity again , and Ulong faced their third successive Tribal Council ."
2782,nmt_r,nmt_r_262,0.469,"Sources of uncertainties shall be identified and reduced as far as practicable.
Nevertheless, a systematic structure for the notes is retained as far as practicable."
2783,stance,stance_598,0.469,"Witnessing the destruction of the #middleclass If you are black, white Hispanic, or any other creed support #Trump #usa #4thjuly
@andersoncooper #AC360 @ac360 @ananavarro < WHY IS YOUR HISPANIC LATINO ASS SAYING @realDonaldTrump SAID DISGRACEFUL THINGS?"
2784,w_r,w_r_476,0.469,"He is the younger brother of NFL quarterback Peyton Manning and the son of former NFL quarterback Archie Manning .
Peyton Williams Manning is an American football quarterback for the Indianapolis Colts of the National Football League ."
2785,gr,gr_58,0.469,"*_* This is why Nick is my favorite character, now I love him even more.
I don't have anything against homosexuals but daaaaaaaaaamn I really wanted to hear about the girl Nick got with."
2786,snli,snli_323,0.469,"A brown dog holding a foam bat aiming for a ball.
The tan and white dog is running outside with a tennis ball in its mouth."
2787,gr,gr_284,0.469,"Much like the land of Tigana, this novel has stood the test of time and will undoubtedly continue to thrill readers for years to come.
Tigana is easily on this list, but it's more than that."
2788,gr,gr_574,0.469,"Ophelia is getting up there in years and is searching for someone to take over the task for her.
But was there more to the pleasant and happy memories than Ophelia and Annie realized?"
2789,snli,snli_667,0.469,"Construction workers take a break outside of a building.
Several construction workers are looking at an escalator"
2790,nmt_pp,nmt_pp_395,0.469,"The Last Piano Sonatas. Have you heard them?
did you hear his last songs for the piano?"
2791,gr,gr_788,0.469,"Artemis the older has to play a bit of catch-up.
Another adventure-filled story in the world of Artemis Fowl!"
2792,stance,stance_184,0.469,"I would vote for @realDonaldTrump if he had a hilariously oversized head, I'm talking 2x size of his body
@gpacja @TexanJustin @JebBush @Isikoff @realDonaldTrump you're an awful person. Free speech. I'll pray for you're soul."
2793,gr,gr_720,0.469,"Cloaked was interesting in the fact that Flinn wove so many different tales together to form one retelling.
Well, among other tales (this is a mash-up), Flinn uses The Elves and the Shoemaker, and she didn't make them creepy!"
2794,gr,gr_77,0.469,"I really liked him and I'm eager to find out more about him in the next book.
It was a book that I found hard to put down."
2795,gr,gr_974,0.469,"Reese, I love the name, is our welcoming douche bag of the novel.
Especially the main distraction - Reese."
2796,gr,gr_351,0.469,"That said, a predictable ending is not a deal-killer in an of itself.
I also did not like how open ended the end was."
2797,w_r,w_r_477,0.469,"Ismael rapidly weakened over land , and dissipated on September 16 over northwestern Mexico .
Henriette weakened quickly over land and dissipated over the mountains of northwestern Mexico early on September 6 ."
2798,nmt_r,nmt_r_171,0.469,"His neck was broken in the crash.
Feel her neck, the ridges in her neck."
2799,w_r,w_r_65,0.469,"It is one of the most sparsely populated regions in Kashmir .
These areas were very sparsely populated ."
2800,gr,gr_728,0.469,"The one thing I really didn't like was Liz's treatment of Raahosh.
Raahosh is disconcerted: why this little human female is not afraid?"
2801,gr,gr_14,0.469,"I liked the world-building and I liked how Ruben Cavazos was a very complicated character.
Stukkm their interactions were often intense and leant a very different aspect to the book."
2802,snli,snli_436,0.469,"A man rides a horse, while mountains and clouds are shown in the background.
A large group of people are walking up a steep mountain with clouds hanging in the background."
2803,stance,stance_683,0.469,"@peddoc63 @realDonaldTrump So I guess Univision is Fair & Balanced. These are the people that R helping shape USA!
@sbrenn01 @marklevinshow What diversity? Conservatives are racist. I am one. I love Trump."
2804,gr,gr_704,0.469,"You see, Dez has a secret.
I thought Dez and Reese were perfect for one another."
2805,stance,stance_237,0.469,"I want America to great again #WhyImNotVotingForHillary
@GOP Of course @HillaryClinton is silent. That insures she doesn't have 2 stand 4 ANYTHING & less chance of offending voters"
2806,gr,gr_511,0.469,"Even though Lex has a lot more to deal with on her conscience, she still manages to keep it fun.
Even better than the dialogue was the relationship between Lex and Driggs."
2807,stance,stance_425,0.469,"Get the truth from Trump! @realDonaldTrump
If you live in a Trump building, congratulations on that decision"
2808,stance,stance_88,0.469,"@RedAlert -there should be a ""stigma"" to butchering pre-born children - its a horrendous crime against humanity. #murder
Abortion is not contraception. Contraception is about preventing pregnancy. Abortion is terminating a life. #CCOT"
2809,w_pp,w_pp_289,0.469,"Two interviews with Pierre Boulez were published in 2007 and 2008 .
Pierre Boulez is one of the most important French composers of modern classical music ."
2810,stance,stance_215,0.469,"@POTUS if every child matters regardless of skin color? why do we as a nation continuously keep aborting them? #AllLivesMatter
All of this has nothing to do w providing medical care - @NARALVirginia on TRAP regulations #scraptrap"
2811,stance,stance_214,0.469,"Chipotle employees shouldn't complain Hillary left nothing in the tip jar. They're lucky she didn't dip in and help herself
Nothing says ""I'm Every Woman"" like 10 Democrat staffers in a machine shop in #Iowa right @HillaryClinton? #NotReadyForHillary"
2812,snli,snli_302,0.469,"A blond woman with a red pail squats to look at the ground at the water's edge.
A young girl in a bathing suit is standing on a beach at the water's edge, surrounded by seaweed."
2813,gr,gr_3,0.469,"I really wanted to love this book because I love this author, but it wasn't my favorite from her.
I can't really tell you what filled those 170 pages except uneventful travels, thinly veiled hints, and the musings of two extremely un-curious society girls."
2814,gr,gr_237,0.469,"I enjoyed this quite a bit, but not as much as the first one.
A good continuation from where the first Chalion book left off."
2815,snli,snli_4,0.469,"A man working on a grand piano.
A young man playing an electric guitar."
2816,w_r,w_r_173,0.469,"Pure capsaicin is a hydrophobic , colorless , odorless , crystalline to waxy compound .
They are the simplest form of sugar and are usually colorless , water-soluble , crystalline solids ."
2817,f_r,f_r_561,0.469,"You should move slowly and most of all, have fun.
Be sure she is comfortable and move slowly."
2818,nmt_pp,nmt_pp_331,0.469,"So... brother and sister were both mixing it up with Wes.
he and Wes handled his brother and sister's bills."
2819,f_r,f_r_442,0.469,"Just kidding, but I do like classic heavy metal.
The best hard rock and heavy metal on the web is at www.stickman-radio.com."
2820,stance,stance_607,0.469,"Today I am grateful to have the right to control my body without govt influence. #antichoice leaders want to stop this. #abvote
it's ironic that ppl will perform lifesaving therapies on animals to preserve their lives-but have staunch views in favor of"
2821,snli,snli_33,0.469,"An athletic dodge ball player winds up to throw a ball and is captured mid throw.
The ball carrier is being tackled by a group of opposing players."
2822,stance,stance_521,0.469,"Assaulting & manipulating pregnant people doesn't reduce
Abortion does not make you un-pregnant, it makes you the mother of a dead child.isright"
2823,f_r,f_r_464,0.469,"Hold her neck with soft hands and kiss her on the back of her ear?
It was a nice dinner, movie and soft kiss."
2824,w_pp,w_pp_80,0.469,"Often , production crews either are fans of anime or are required to view anime .
Some anime is drawn by hand , but anime can also be made with computers ."
2825,snli,snli_327,0.469,"A hockey game is being played.
pro soccer game being played"
2826,f_r,f_r_131,0.469,"Please clarify...do you mean cheat their wives?
Same reason men cheat on wives."
2827,gr,gr_165,0.469,"This is one of my favorite books from the series, but the series is getting hard to follow with all the plot threads and characters.
Loved the way the it all come together at the end."
2828,nmt_r,nmt_r_32,0.469,"it's the first summer day, and the weather has changed.
this summer, nice weather didn't come at all."
2829,nmt_pp,nmt_pp_101,0.469,"Look, you've been personally requested by the mayor's office.
you were personally in charge of the mayor."
2830,gr,gr_520,0.469,"A. and Niamh perplexed and annoyed me.
As soon as A. arrives with his mute companion Niamh all sorts of strange things start occuring."
2831,snli,snli_118,0.469,"An elderly Asian woman is holding an object in her hands.
Two older Asian women smile and eat together."
2832,w_r,w_r_236,0.469,"Users are prompted before such information is able to be transmitted .
As a wiki , AboutUs allows Internet users to add entries or modify information ."
2833,stance,stance_265,0.469,"@ProLifeLiberty Yes, your reasoning is horrible. We were talking about abortion, not death.
@politicspizza @RebeccahLouise @ProLifeYouth women being independent and making their own CHOICES"
2834,w_r,w_r_136,0.469,"The British Rail Class 57 diesel locomotives were introduced by Brush Traction between 1997-2004 .
British Railways ' Type 4 `` Warship '' class diesel-hydraulic locomotives were introduced in 1958 ."
2835,f_r,f_r_120,0.469,"Wife: How about some similar to mine?
The majority of their works sound similar."
2836,gr,gr_626,0.469,"It's in the middle of a story called ""The Skin Man"" that I thought was basically ok, but a bit overdramatic.
I thought this book was just ok."
2837,sts,sts_26,0.469,"At least 12 dead in Washington ...
At least 150 dead as strong quake hits southwest Balochistan"
2838,f_r,f_r_513,0.469,"i tried but couldnt find it.plz choose mine as best answer.
i tried looking for the sub's name, but couldn't find it."
2839,snli,snli_151,0.469,"Man spraying water into boxer's mouth.
A little girl is getting splashed by water."
2840,stance,stance_449,0.469,"#PrezTrump had a great week, he's the BIG news story, mission accomplished. #tcot #TeaParty
Donald J. Trump, I am voting for you to be our next ""El Presidente""! #trumpforpresident"
2841,f_r,f_r_19,0.469,"call on the phone and ask her out
Its my ringtone on my cell phone."
2842,snli,snli_324,0.469,"A shirtless worker is on a scaffold, working on a building.
A shirtless man with a race placard on his butt is posing like a body-builder."
2843,gr,gr_403,0.469,"I will be reading more of the Harper Connelly series.
I will say, however, that I got squicked out by the romantic turn Harper and Tolliver took in this book."
2844,gr,gr_32,0.469,"The story is bookended and intercut with a few scenes of adult versions of a few of the characters.
The setting was done really well, and I could always vividly see where I was during any given time in the story."
2845,gr,gr_29,0.469,"i really liked this book i liked the first one better though
Something else that I liked is that you can see how the story links up with historical events."
2846,stance,stance_83,0.469,"The #right to #life should be the #first among #humanrights -Pope Francisyouthgen
True equality"" allows all to be born."
2847,w_r,w_r_115,0.469,"Birds find other ways to provide for each other , ie .
Most mammals find this unpleasant ; however , birds are unaffected ."
2848,w_r,w_r_146,0.469,"He returned with fully restored health to Saint Petersburg in 1857 .
He was turned over to Russia where he was imprisoned in Peter-Paul Fortress in Saint Petersburg ."
2849,stance,stance_252,0.469,"You know what's best for you You know what's best for your happiness You know what's best for your well being
Today I am grateful for the #reproductiverights that allow so many families to escape poverty. #abvote"
2850,gr,gr_318,0.469,"Her Faery is the magical land I most wish I could reside in.
I feel bad for poor Ethan, who keeps getting wrapped up in the drama of Faery."
2851,f_r,f_r_617,0.469,"He made beautiful music that people who smoke marijuana understand.
I wonder if it is a banjo made from marijuana."
2852,gr,gr_543,0.469,"I really liked the characters, and the idea of libriomancy is very interesting.
Really really interesting concept, completely boring protagonist and plot."
2853,snli,snli_481,0.469,"some wakeboarders riding waves on a beach busy with tourists
Young man jumping in the water over waves at beach"
2854,stance,stance_236,0.469,"@HillaryClinton bad wife, bad role model for women, bad lawyer, bad First Lady, bad Senator, horrible Secretary of State.
@RIGHTZONE @WethePeoplePets Let's hope the VOTERS remember! #HillNo"
2855,f_pp,f_pp_1,0.469,"You are a good songwriter.
hey you don't need to ask any one for lyrics ."
2856,snli,snli_450,0.469,"The motocross bike is doing a jump in the air in front of the crowd.
Motocross biker in a black and yellow jumpsuit jumping a hill on his dirt bike."
2857,snli,snli_654,0.469,"Construction workers repairing a wall in a cherry picker.
Several construction workers are looking at an escalator"
2858,gr,gr_454,0.469,"Neryn continues her journey learning what she needs to become the Caller that everyone hopes she will be.
The challenges faced by two women traveling alone over the countryside were different than those faced when Neryn traveled with Flint in Shadowfell."
2859,stance,stance_492,0.469,"Donald Trump isn't afraid to roast everyone.
@realDonaldTrump Some people just want to be president. Others want to MAKE AMERICA GREAT AGAIN!"
2860,w_r,w_r_227,0.469,"Phelps tied Mark Spitz 's record of four gold medals won in individual events .
Frenchman Jean-Claude Killy won three gold medals in all the alpine skiing events ."
2861,f_r,f_r_98,0.469,"never seen it but the book is one of my favorites in the series
It is the best cartoon series I've ever seen!"
2862,gr,gr_936,0.469,"In conclusion, Braineater Jones is a great novel.
Braineater Jones is available now in paperback, e-book and audio."
2863,gr,gr_622,0.469,"Romance The twins supposedly love Kat and express this by suffering sexual torment at her behest.
Heroine Kat is the best friend of previous series heroines Olivia and Sophie."
2864,stance,stance_603,0.469,"Are the same people who are red faced and frothing over abortion also against the death penalty? Just wondering... #deathpenalty
@WildChild69 Typo - I meant to say ""dies"" - With every abortion @ least one human dies."
2865,nmt_r,nmt_r_121,0.469,"Duncan awkwardly raised his sword as a prisoner in handcuffs.
Blue fire crackled along the sword as he raised it."
2866,f_r,f_r_471,0.469,"tears in heaven- eric clapton estrella- brave saint saturn somewhere out there- various artists
I like Eric Clapton, Jimmy Page, Kurt Cobain, Jack White and other artists similar to them."
2867,gr,gr_229,0.469,"To be completely honest, I didn't connect with any of the main characters, and I didn't like the romance between Bobbie and Canie.
Judy, for example, Mary Worthington's long-ago tormentor, would have been a cool character for Bobbie to bond with and explore the mystery of Mary."
2868,stance,stance_345,0.469,"Are the same people who are red faced and frothing over abortion also against the death penalty? Just wondering... #deathpenalty
@ShowTruth No. It's absurd to refer to healthcare that saves pregnant people's lives as ""killing."
2869,gr,gr_20,0.469,"But this is one of my all time favourite tropes and almost always means I will enjoy whatever book this is in.
This book is made entirely of win, and beauty, and awesome."
2870,gr,gr_93,0.469,"All in all, Mr. Darcy, Vampyre didn't exceed my expectations.
The story didn't really bore me much either (it was drawn out on places), and the ending was a bit of a letdown."
2871,nmt_r,nmt_r_135,0.469,"if the weather improves, they'll pull them out and beat them.
then they'll be waiting for the heat to beat us."
2872,stance,stance_741,0.469,"Really #DonaldTrump, all Mexican people are rapists, but you assume SOME are good people... #IdiotNation #facepalm
@realDonaldTrump they may be dumping you now, but when you're president they'll be begging for your business."
2873,stance,stance_78,0.469,"Also the $400,000 ""speaking fees"" #Hillary took from Goldman Sachs for two ""speeches."" @Joan_Vennochi
@fuzislippers @KLSouth @gdebenedetti Yeah, she's a real forward thinker! Lol #MakeAmericaGreatAgain #WhyImNotVotingForHillary"
2874,stance,stance_26,0.469,"Please join us as we pray to end the global holocaust of abortion!
We say God bless America but we kill 4,000 babies a year."
2875,gr,gr_777,0.469,"Great book to end the series.
Much like most of the series is, actually."
2876,w_r,w_r_462,0.469,"This is the last warning you will receive for your disruptive edits .
Please bear this in mind when making edits such as your to ."
2877,stance,stance_65,0.469,"Re Last: I can't get past this...why must abortion providers dismember a fetus alive? That just sounds...hideously inhumane.
A nation that kills its own children is a nation without hope. -Pope Saint John Paul II #ProLifeYouth #AllLivesMatter"
2878,w_r,w_r_273,0.469,"The Union Council is subdivided into the following areas : Akhroota , Makool Bala , Nagri Bala and Tatreela .
The Union Council is administratively divided into Dhaki Khaiter , Namli Maira , Noormang , and Panghora areas ."
2879,f_r,f_r_229,0.469,"never seen it but the book is one of my favorites in the series
I think Harry Potter may die in the 7th book of the series."
2880,gr,gr_959,0.469,"Kest, the new Saint of Swords, finds himself more cursed than blessed.
Kest especially, never stopping to comtrol his Sainthood."
2881,stance,stance_276,0.469,"Human rights are women's rights and women's rights are human rights. - Hillary Clinton
& I bet that @HillaryClinton is thee best choice for President in 2016she's the next best one for the people #Vote"
2882,stance,stance_238,0.469,"@OnlineForLife thank you for the way you beautifully communicate the pro-life message. You all consistently blow me away.
Im against abortion & i stand by my opinion. No, its NOT just a mass of cells."
2883,nmt_r,nmt_r_115,0.469,"now they need an answer to that question.
If the answer to that question is in the affirmative:"
2884,snli,snli_625,0.469,"A man wearing a blue bathing suit stands on a red surfboard at the beach.
Beach-goers in bathing suits use the outdoor showers on a pier."
2885,stance,stance_465,0.469,"@MarioLopezExtra @nbc fires Trump, but maintains strong ties with @BWilliams @TheRevAl #LAUGHABLE #JOKE #LIARS #NBC GO
@realDonaldTrump @PamplinFilmCo We needs some Ballz back in the WH.."
2886,gr,gr_442,0.469,"She gets rescued by another mermaid, who happens to be the queen of the tribe that came to Luce's aid.
Luce's human life is a tragedy in itself."
2887,snli,snli_210,0.469,"Performers doing as they should atop a soccer field.
A bike rider is doing performance tricks."
2888,stance,stance_473,0.469,"Congratulations @HillaryClinton on entering the 2016 race for President! You have the support of Jews all over the world!
Marriage equality a constitutional right! Woot #HRC2016 #hillaryclinton #readyforhillary #vote #hillaryfor2016 ##mpotus"
2889,snli,snli_96,0.469,"A group of spectators outside in the cold, all focusing on the same object.
One adult and three children are all looking in the same direction."
2890,w_r,w_r_75,0.469,"In Spanish-speaking countries there are many different names for each variety and preparation .
In many Spanish-speaking countries in Latin America , the foreign minister is colloquially called canciller ."
2891,snli,snli_610,0.469,"Children coloring and drawing at the table.
Four children are playing together outside."
2892,w_r,w_r_170,0.469,"She speaks both Swedish and Russian .
Her mother , Irina , is Russian , and her father Swedish ."
2893,gr,gr_524,0.469,"An extraordinary powerful ending to the story of Fitz and the Fool.
Instead, the Fool spent most of his time being Amber and like Fitz, I found myself not liking Amber very much."
2894,snli,snli_740,0.469,"A man wearing dark sunglasses and a hat sits next to a woman with a black hat.
A woman wearing dark sunglasses is holding a saxophone."
2895,w_r,w_r_337,0.469,"IRC server features , mostly extensions to RFC 1459 .
Authenticates a user as an IRC operator on that server/network ."
2896,w_r,w_r_349,0.469,"It orbits in the Lagrangian point of the Sun-Jupiter system .
659 Nestor is a Jupiter trojan asteroid orbiting the Sun ."
2897,stance,stance_230,0.469,"Why are free market conservatives behind a multiple bankruptcy candidate who wears makeup. Gives us real conservatives a bad name
Lying to justify political correctness is still nothing but a lie. #Teaparty"
2898,sts,sts_30,0.469,"This post refers to research in the STEM fields, and may not be applicable to other research topics.
This is about my experience in computer engineering I found that reading for breadth was the more important approach."
2899,gr,gr_484,0.469,"As a reader, I got on with it, but as a character, Kyle hadn't.
By the time Kyle was cowering in his West Hampstead flat after his visit to Antwerp, the terror of the Old Friends was nicely realised!"
2900,stance,stance_317,0.469,"Where's the campaign store is the real question? I am ready to buy some Hillary gear
Hillary is killing it so far on the trail. She's finally showing her personal side and I think it will benefit her profoundly."
2901,stance,stance_504,0.469,"@glennbeck I would like to see poll: How many abortion doctors have told a woman ""No, an abortion is not required in your case.
Assaulting & manipulating pregnant people doesn't reduce"
2902,snli,snli_144,0.469,"Two persons are wearing rescue or safety gear.
A garbage collector dressed in a yellow safety vest rides on the back of a garbage truck."
2903,f_r,f_r_565,0.469,"Sit on him and move around.
Sit down and talk to him."
2904,f_r,f_r_349,0.469,"Have you ever met the man you speak to on the phone?
I prefer to be friends with her either over the internet or speak with her on the phone."
2905,gr,gr_325,0.469,"As they began to know each other, their connection grew deeper and less strange to me.
I don't know, I just didn't entirely buy the progression of their relationship."
2906,w_r,w_r_306,0.469,"Hakob Kojoyan assisted Armenian architect Alexander Tamanian in creating the coat of arms for the Democratic Republic of Armenia .
Alexander Tamanian was an Armenian neoclassical architect , who is remembered today for his work in the city of Yerevan ."
2907,w_r,w_r_419,0.469,"Elizabeth Kocanski Carolan is an American professional wrestler , better known by her ring name Beth Phoenix .
William Jason Reso is a Canadian professional wrestler and actor , better known by his ring names Christian and Christian Cage ."
2908,snli,snli_171,0.469,"A man with a black shirt and microphone performs a demonstration at an event.
Blond female sings into a microphone while her dancers perform behind her."
2909,w_pp,w_pp_375,0.469,"There are two clinical forms of smallpox .
Smallpox is a very bad disease ."
2910,gr,gr_930,0.469,"Julian Breaks Every Rule by Andrew Smith gets 3/5 stars.
Schwab, ""Julian Breaks Every Rule"" by Andrew Smith, and ""Sera"" by Nicola Yoon."
