Index,DocID,PairID,Score,Text
3937,f_r,f_r_348,0.344,"On average, I'd say once or twice a week, sometimes more.
Sometimes he does go a week without doing it."
3938,gr,gr_415,0.344,"He seems to know something that we're not privy to and, at first, I wasn't quite sure if I should trust him with Julia.
Julia is broken in the beginning of this book."
3939,gr,gr_784,0.344,"Rating: 4.5 Stars Threats of Sky and Sea is a strong fantasy story.
You may be happy to learn that there is no insta-love or a love triangle in Threats of Sky and Sea."
3940,snli,snli_304,0.344,"A woman sticking her tongue out while be photographed.
A woman takes a photo of a baby being held by a man."
3941,snli,snli_217,0.344,"A gut wearing a plaid shirt with a mustache selling fish at a market.
A male is standing in a river and fishing and is holding a net."
3942,f_r,f_r_682,0.344,"They tell alot about a person.
I like alot of different types."
3943,w_r,w_r_213,0.344,"It takes place in a fictional private charity hospital .
The game takes place on the fictional eponymous planet , Notrium ."
3944,stance,stance_357,0.344,"Human rights are women's rights and women's rights are human rights. - Hillary Clinton
This weekend is the Hillary For America Weekend of Action & I hope you'll participate. -L #California"
3945,f_r,f_r_236,0.344,"Helicopter crash is on his way to a concern in St. Louis Mo.
You would have to go to East St. Louis in Illinois for that."
3946,sts,sts_40,0.344,"A man is mowing grass.
A man is busting concrete."
3947,gr,gr_271,0.344,"The story is developing well, and the characters are starting to take on a life of their own.
Geder is taking individually sensible steps that are heading towards stalinesque style pogroms and it is very believable."
3948,f_r,f_r_505,0.344,"Meaning that it need cared for and about.
If you understand my meaning."
3949,stance,stance_192,0.344,"Donald Trump inhaled so much air spray & started to believe he is the title holder for the United States.
Well, someone's doing the raping. I get combed and gooped up so much, Donald's the one doing the raping. He never understands."
3950,nmt_r,nmt_r_182,0.344,"it is rarely treated as flagrant cases such as this one.
I've treated thousands of cases, and I've not lost a single patient."
3951,gr,gr_9,0.344,"It had me screaming with excitement I would recommend this book for anyone that loves science and action.
This book also feels very rushed in the beginning, and even though I like a fast pace, this is too much."
3952,snli,snli_83,0.344,"A blond women wears a jacket with an eye on it.
a woman in a yellow jacket following two other women."
3953,w_r,w_r_251,0.344,"Luxembourg is divided into 3 districts , which are further divided into 12 cantons and then 116 communes .
The departments are further divided into 41 arrondissements , and 133 communes which serve as second - and third-level administrative divisions ."
3954,snli,snli_382,0.344,"Two people work with garden tools in a rocky landscape.
A white dog is walking through a river that runs through a rocky landscape."
3955,snli,snli_735,0.344,"A girl sitting in the back of a cart full of various belongings.
A woman trying on her wedding dress with the help of two other women."
3956,snli,snli_469,0.344,"A man, seated, serves food to a little girl.
Fall shoppers and bistro food lovers caught in the ebb and flow of the city."
3957,gr,gr_121,0.344,"Alyson Noel made him seem older and wiser, but to the point of boring.
Maybe a darker side of Ever will emerge in later books and we might get to see some more of him (wink wink, nudge nudge)!"
3958,sts,sts_28,0.344,"Two men standing in grass staring at a car.
Two women sitting in chairs in a shop."
3959,f_r,f_r_358,0.344,"Figure it out and then go to a website with those kinds of products.
They feel as if they want to have those kinds of things."
3960,f_r,f_r_673,0.344,"I hae no problems with them.
You have some problems, sir."
3961,w_r,w_r_484,0.344,"This category groups articles on topics relating to the Grand Theft Auto series of computer and video games .
This category lists articles relating to transport by tram , street-running light-rail or similar systems in the United Kingdom ."
3962,w_r,w_r_87,0.344,"The eggs are a brownish color .
Another name for this color is mallow ."
3963,stance,stance_467,0.344,"The Left fear Donald Trump, BIG TIME! @realDonaldTrump
Why is it wrong when Trump is stating facts about illegal immigrants??? He is 100% Right"
3964,gr,gr_671,0.344,"Can the pretense turn into something real?
Pretending to be mated turns real."
3965,f_r,f_r_308,0.344,"I need advice on discipline?
My advice is to stop looking."
3966,f_r,f_r_641,0.344,"It originally meant ""disc jockey,"" but say ""dance jamster.
I will warn you that disc jockey equipment is expensive."
3967,w_r,w_r_147,0.344,"Nathaniel Hawthorne was an American novelist and short story writer .
Maria Edgeworth was an Anglo-Irish novelist and children 's writer ."
3968,stance,stance_377,0.344,"Lmao my school thinks giving women the right to an abortion is against feminism. They don't know feminism #wtf
They know what's best for their health They know what's best for their happiness They know what's best for their well being.."
3969,snli,snli_386,0.344,"People are gathered on a city street with police vehicles arriving.
Man in black helmet drives all terrain drives all terrain vehicle."
3970,nmt_r,nmt_r_37,0.344,"And that joe cocker song comes on?
Go over the song selection with Bob."
3971,gr,gr_690,0.344,"But it was good to see what it would have been like if Edward had been a girl and Bella a boy.
At least Bella and Edward sit nicely together."
3972,stance,stance_564,0.344,"@readyforHRC @HillaryClinton #HillaryClinton, the US presidency is a testament to the success of #women their role in the world
@FoxNews @GovChristie @HillaryClinton Actually she should be disqualified from running!How many scams and ethics problems now?"
3973,f_r,f_r_469,0.344,"Everyone wants to hang out with fun and interesting people.
Although not for everyone, it is interesting."
3974,stance,stance_217,0.344,"@NBC to #Trump: ""HOW DARE YOU POINT OUT THAT OBAMA CAUSES 1000 GIRLS TO BE RAPED EVERY MONTH CROSSING INTO USA!"" #ccot #tcot
,@realDonaldTrump trumps presidential dreams r about as real as KimJonguns unicorns."
3975,sts,sts_39,0.344,"A man is selling items.
A man is cleaning the house."
3976,stance,stance_690,0.344,"@NYCanegirl the premeditated taking of an innocent human life is 1st degree murder, and you know it.
Bernadette Smyth is an ignorant thunder cunt. Not her life. Not her body. Not her business. #ItsABallOfCellsNotABaby #NewsNI"
3977,gr,gr_638,0.344,"Gorgeous illustrations are quite reminiscent of the wonderful animated movie.
5 stars for a gorgeous production."
3978,stance,stance_605,0.344,"Hillary Clinton has not driven a car since 1996. #clintonfakerealityshow
Let's make Secretary Clinton, President Clinton - @AGMarkHerring @vademocrats"
3979,snli,snli_289,0.344,"A woman admires her reflection in a display window.
The little boy crawls around next to the large glass windows."
3980,stance,stance_91,0.344,"So @ClintonFdn, I believe Andrew Fastow beat you to the ""we made mistakes, as many organizations of our size do"" excuse
RT @muradguderian: Democrats are Red, Obama is a Communist, I'm a true Patriot, So stop Hillary. #tcot"
3981,f_r,f_r_553,0.344,"With the exception of the funniest, it applies.
Paige is the funniest to me."
3982,f_r,f_r_112,0.344,"he got shot in the back,
No, House is shot during the finale."
3983,gr,gr_685,0.344,"Uptight Lance enjoyed letting go and letting Tim take care of him!
However the humor and the dogs and Tim made this a SOLID read."
3984,snli,snli_451,0.344,"Kids running in the field.
Baby crawling inside a toy."
3985,stance,stance_61,0.344,"#Hillary, Here's one Christian whose religion views will never ""adapt"" to include abortion. Abortion is murder.
If #BlackLivesMatter why not black babies in the womb? Somehow their lives don't matter.... puzzled with that one. #catholic"
3986,sts,sts_19,0.344,"A man is smelling two pizzas.
A woman is feeding a man."
3987,stance,stance_282,0.344,"@HillaryClinton loving the new colorful profile pic! #loveit
The only Intelligent Choice for USA is Hillary Clinton....You can not afford to stay HOME ...you must VOTE and VOTE #UniteBlue"
3988,f_r,f_r_30,0.344,"What if he gets mad and wants nothing to do with you?
When you talk about other girls, she gets mad."
3989,stance,stance_14,0.344,".@HillaryClinton is a droid & someone's programmed her to say things - thinks she doesn't have to WORK to win so she ISN'T!
Hillary claims to be a ""champion"" of the middle class, but @RandPaul tax plan cuts the FICA tax, benefiting the middle class."
3990,stance,stance_201,0.344,"Hillary Clinton keeps sending me emails, and when I try to unsubscribe, I get an error message. THIS IS CANCER
@HillaryClinton will be the nominee for the Democratic Party. Period. And she's gonna win the Presidency too. #SorryBernie"
3991,gr,gr_279,0.344,"I will be continuing on with this series just so I can have closure.
It would be more accurate to say that I saw potential, and was curious to see whether book two would deliver on it."
3992,snli,snli_153,0.344,"Sonic employees talking about work.
Two adults talking after class."
3993,f_r,f_r_56,0.344,"Ample parking day or night, people spouting, Howdy neighbor!
That night, I do not think we left the parking lot."
3994,w_r,w_r_396,0.344,"At the war 's conclusion , Poland 's borders were shifted westwards , pushing the eastern border to the Curzon Line .
The famous river Padma borders Rajshahi division on the south and another famous river , Jamuna , lies across the eastern border ."
3995,f_r,f_r_532,0.344,"They captured the villian at the end!
It's similar to the end of Prisoner of Azkaban."
3996,nmt_r,nmt_r_8,0.344,"the server is a SOCKSv5 proxy server.
caching proxy server for Debian archive files"
3997,sts,sts_23,0.344,"A woman is talking to her pet bunny as she fondles it.
A woman walks her dog onto astro turf."
3998,stance,stance_404,0.344,"@realDonaldTrump Go get 'em Mr. Trump!!!
@VLActionFund @Reince The same #RNC LOSERS that thought Romney & Palin were good choices needs to be THANKFUL Trump came along"
3999,w_r,w_r_375,0.344,"In the visible spectrum , Ananke appears neutral to light-red .
The colors used range from light blue to red to a very controversial orange ."
4000,w_r,w_r_431,0.344,"You can `` quote '' categories by adding a colon before `` Category '' , like this : .
This category is for categories that group articles by geographical location ."
4001,stance,stance_267,0.344,"@JebBush and @marcorubio cannot speak their minds b/c they are paid 2 keep things pc. @realDonaldTrump ANSWERS TO NO ONE!
@realDonaldTrump I don't care what @NASCAR says! I dont care what the liberals at @espn say.. Keep Speaking The TRUTH!!"
4002,snli,snli_600,0.344,"Two women, one with a camera, reach out and touch a mirrored ball.
A tall blond women wearing stockings walking away from the camera."
4003,gr,gr_702,0.344,"I am still wondering who Erec Rex is?
The crazy contests Erec and Bethany faced were imaginative and compelling."
4004,gr,gr_432,0.344,"The other kids are tough, and Perry gets into a fight.
So, the entire time, as I was reading THE OTHER NORMALS, I kept thinking about Perry from UNDER THE NEVER SKY by Veronica Rossi."
4005,nmt_r,nmt_r_247,0.344,"And you like the way the french doors open out to the deck?
Because the doors open to constituents in an hour."
4006,w_r,w_r_23,0.344,"She was towed to Buenos Aires , Argentina and then to Kristiansand , Norway for repairs .
Mar del Plata is the most popular destination for conventions in Argentina after Buenos Aires ."
4007,gr,gr_425,0.344,"Chambers style is flowery and poetic throughout but his ""horror"" stories are much stronger than the romance stories in this collection.
(Personal footnote: I love this book so much, I once wrote a story for an anthology based on THE KING IN YELLOW."
4008,f_r,f_r_304,0.344,"First off, Fall Out Boy are not good live.
I am happy with any song by Fall Out Boy or Hawthorne Heights."
4009,gr,gr_536,0.344,"Rayfe is the King of the Tala and needs to convince Andi to return to their land with him.
The Tala are basically the fae."
4010,f_r,f_r_477,0.344,"So yes, women care about money.
My money goes on us girls."
4011,gr,gr_369,0.344,"I have nothing really good to say about it, nor bad.
Like I said: too good to be true."
4012,f_r,f_r_44,0.344,"What's the song that Barney the Purple Dinosaur sings?
it sounds like that song that sings what's up pus*y cat?"
4013,w_r,w_r_463,0.344,"This common military experience spawned a personal friendship between Robinson and Louis .
Robinson 's continued success spawned a string of death threats ."
4014,f_r,f_r_566,0.344,"Keep reading his bio at my source
try reading the lyrics to the song"
4015,snli,snli_605,0.344,"A child in school, holding a ball as she points a the frisbee.
Child holds up a picture of Mahmoud Ahmadinejad while men converse behind him."
4016,stance,stance_57,0.344,"@fuzislippers @KLSouth @gdebenedetti Yeah, she's a real forward thinker! Lol #MakeAmericaGreatAgain #WhyImNotVotingForHillary
Since #SNL ain't that funny anymore please @JoeBiden run for president.. if even just for the hilarious debates between you &"
4017,snli,snli_276,0.344,"A wakeboarder is leaping into the air whilst holding onto a yellow rope.
A young white man is climbing a mountain with a rope as a guide."
4018,f_r,f_r_576,0.344,"I am honestly wondering what the symbol would be for.
I am also wondering about that. Honestly, the outlook is not good."
4019,stance,stance_334,0.344,"297 days until I can register to vote!!1 year 193 days until Election Day #RockTheVote #democrats #everyvotecounts
Bernie or Hillary? Prefer Bernie but Hillary fine. Either way, Dems gotta stand together in 2016. #FeeltheBern"
4020,snli,snli_261,0.344,"A woman running into surf.
A man kayaking through rapids."
4021,w_r,w_r_358,0.344,"New Delhi is the capital of India .
Crime is present in various forms in India ."
4022,stance,stance_415,0.344,"I like many entries in the 2016 Presidential race; but no one is more accomplished than Donald Trump. His cabinet will be full.
If a liberal brings up Immigration, hit em with the ""TRUMP"" card! #trumpforpresident #Trump #tcot"
4023,f_r,f_r_527,0.344,"try downloading the limewire search and download engine, kiddo!
You should use google or another search engine."
4024,gr,gr_161,0.344,"She made him work for it.
I had more sympathy for him than Adrienne, which was refreshing."
4025,f_r,f_r_273,0.344,"In addition, we are on a fairly restrictive budget!
In addition, Lorelai is fairly sufficient to experience visually."
4026,gr,gr_102,0.344,"So I'm glad I waited this long to read it because it means I'll have less time to wait for the next one.
I read the best, bloodiest parts while sitting in a salon and getting a pedicure."
4027,gr,gr_67,0.344,"Many ideas in this had a great creative start.
She doesn't do to many stupid things in this book."
4028,w_r,w_r_176,0.344,"Samuel Timothy `` Tim '' McGraw is an American country singer and actor .
Dolores Hope is a singer , philanthropist and the widow of actor Bob Hope ."
4029,f_r,f_r_623,0.344,"go into a shop and try one
or take it to a repair shop"
4030,stance,stance_668,0.344,"Miss USA host De la Fuente quits pageant and call @realDonaldTrump ignorant and a clown...
@realDonaldTrump keep it up Trump we love you #MakeAmericaGreatAgain #BoycottMacys #boycottnbc"
4031,stance,stance_48,0.344,"Donald Trump needs to stop embarrassing himself. Racist assholes....
Hey hypocrites @Macys since u pull @realDonaldTrump merchandise from stores why dont u pull #racist #JAYZ CRAP #2FACEDLIBERALS"
4032,gr,gr_493,0.344,"I like the fact that Henry broke his own rule just to see Kate smile.
I absolutely loved this fiery and willful Kate, and, gosh, I want to see much more of her in the third book!"
4033,snli,snli_473,0.344,"A man in yellow looks to be DJing for Smirnoff at a party.
A young male child in a yellow shirt being fed a banana."
4034,gr,gr_188,0.344,"I really enjoy Shusterman's take on the afterlife, and how he slyly explains all sorts of phenomenon using the scaffolding of the Everlost.
He just possesses raw talent and an amazing imagination."
4035,nmt_r,nmt_r_26,0.344,"Her fingers could fall off. Her toes could fall off.
Great, hooked claws curled from its fingers and toes."
4036,gr,gr_195,0.344,"Charley's dad is also up to something, but Charley doesn't know what, though it appears he's leaving Charley's step-mom.
The Charley Davidson awesome brand of craziness continues."
4037,gr,gr_482,0.344,"Heart Of Stone is book one in the Gargoyles series by Christine Warren.
But, as it stands, book one did not win me over enough to continue on with the series."
4038,w_pp,w_pp_84,0.344,"Grief-stricken by his father 's rejection , Idamante runs off .
Idamante does not understand why his father is saying this ."
4039,sts,sts_66,0.344,"A man is riding a horse.
A man is driving a car."
4040,snli,snli_64,0.344,"This fisherman is mending his nets.
A man on a ladder repairs the roof of a building."
4041,gr,gr_352,0.344,"Tove was impressive and a force to be reckoned with, but cast aside by the author and the main character for reasons unknown.
She stands her ground and will not be swayed."
4042,gr,gr_595,0.344,"This was slightly better than the horror that was Blue Moon, however it still didn't reach the heights of the first in the series.
its not the best becuase i picked up on it immediately, totally giving away the ending, but still."
4043,stance,stance_358,0.344,"@Montel_Williams , ex 2bit talk show host, talking shit about @realDonaldTrump . Fuck off montel!! @cnn.
@realDonaldTrump Just watched you on @FoxNews. You are awesome! You have my vote! #MakeAmericaGreatAgain"
4044,snli,snli_277,0.344,"Construction man paving large concrete steps.
A man and woman assemble a metal structure."
4045,snli,snli_711,0.344,"Cafe Express"" sign covered in graffiti.
A young skateboarder rolls down a graffiti-covered ramp."
4046,f_r,f_r_514,0.344,"Just go to iTunes and find iPod and put the music on it again.
Does anyone know how to put pictures on an Ipod Nano?"
4047,gr,gr_462,0.344,"Like, listen, Jesse's been around Suze waaay to long to be as old-fashioned as he was.
Is Suze wearing boots that I would die for?"
4048,snli,snli_529,0.344,"An elderly musician sits, contemplates, listens and waits.
A woman waits in the shade while an older, seated man stares at her from behind."
4049,snli,snli_704,0.344,"Black dog prancing through the river.
A girl splashing in a wave at the beach."
4050,stance,stance_118,0.344,"I feel confident that @HillaryClinton will win in 2016.
@chicagotribune #ayyylmao do #Democrats & other #liberals realize no one wants #HillaryClinton which is #Obamanation 2.0?"
4051,gr,gr_46,0.344,"I think I had to come to grips with the fact that Chris Paolini is essentially a different author from his first book, Eragon.
I was bored during this book."
4052,nmt_r,nmt_r_257,0.344,"ask your mother for forgiveness.
Leaving behind a huge debt for my mother."
4053,gr,gr_383,0.344,"And for the record I'm team Will ^-^
I am team Jem all day, every day."
4054,gr,gr_208,0.344,"It is one of those books that give you hope that not all is bad.
If you have seen the movie Blade 2, I would not suggest reading this book."
4055,stance,stance_554,0.344,"Everybody get on the Trump Train!! It's a First Class One-Way ticket to the White House with @realDonaldTrump
@TIMENOUT @TIB2016 @AlanColmes is a prime example of a #LobotomizedLiberal."
4056,stance,stance_508,0.344,"@HillaryClinton had more twitter followers then all four major Republican candidates (Bush, Rubio, Paul, Cruz) COMBINED.
@foxnation That should have been done BEFORE she got rid of it!!! #NoHillary2016"
4057,f_r,f_r_347,0.344,"check out this site for more info:
Check out Deep Impact, on the internet."
4058,f_r,f_r_5,0.344,"The Bangles Hazy shade of Winter.
You are on budget for the winter."
4059,nmt_r,nmt_r_111,0.344,"secondly, eliminating the threat from the Ousters.
- Terrorism remains a threat to the Union."
4060,snli,snli_381,0.344,"An extreme mountain biker making a leap across rough terrain in the woods.
A fit young man is repelling up a mountain wall in a forested area."
4061,stance,stance_615,0.344,"@TPM @realDonaldTrump this is what happens when you open your big mouth. You're out of luck for 2016 at this rate. #Univision
If a liberal brings up Immigration, hit em with the ""TRUMP"" card! #trumpforpresident #Trump #tcot"
4062,stance,stance_50,0.344,"I love how everyone thinks canceling @realDonaldTrump's ventures will do anything but hurt themselves. This man has my vote!
We need a man that will do the tough negotiations, say what needs to be said and forget the words politically correct. #thanks"
4063,snli,snli_425,0.344,"Three girls in blue, one doing a handstand and the splits on a basketball court with people in the background.
A young woman is doing push ups in front of three members of the armed forces at a conference event."
4064,nmt_pp,nmt_pp_3,0.344,"Process with PID %1!u! was forcibly terminated.
the password for% 1! U! Has been completed."
4065,gr,gr_8,0.344,"There's no way to urge people to this buy this book unless they haven't seen the film.
This gave me this same chills down my spine and yet I would return to my bed and curl up to read this book!"
4066,f_r,f_r_226,0.344,"he got shot in the back,
Dan drew first and shot."
4067,gr,gr_315,0.344,"(1 star) Ghost Trap by Rick Hauta - This was a perfect zombie story.
The Zombie Who Fell From the Sky - M.B."
4068,sts,sts_24,0.344,"Feet standing on a pretty day with large building in background.
Two police officers standing behind a van with a bus in the background."
4069,gr,gr_24,0.344,"This book is one of the most hilarious books I have ever read!
The style seemed different somehow than the previous books and I wasn't engaged by the story or characters."
4070,w_r,w_r_492,0.344,"In 1965 , a colony was discovered near Marysville , in the Upper Yarra Valley .
The city of Yakima is located in the Upper Valley of Yakima County ."
4071,stance,stance_566,0.344,"Rise & Shine its a new day & you're alive. Thank God 4 another day of precious life. #Christian #Catholic #TeamJesus
@LogicOfLife7 I don't confuse ""right to life"" with 'right-to-use-someone's-body-without-consent'. Do you? #rapeculture"
4072,w_r,w_r_334,0.344,"He went on to win the trophy the next two seasons as well .
He lost to Shinjiro Otani in the match , but WCW went on to win the series ."
4073,stance,stance_51,0.344,"@Molls30 @HillaryClinton I love it! One of our biggest donors is Saudi Arabia. They support women's rights completely! #GoTeam
@GovChristie can't even run NJ and wants to be president? I'd vote for him before @HillaryClinton"
4074,nmt_r,nmt_r_153,0.344,"You can start by taking a trip, a long trip.
Have thought of taking a short trip to the cottage."
4075,snli,snli_116,0.344,"A woman in a black cap and outfit sits in the sand.
A brown dog plays in the sand near a man in a green cap."
4076,f_r,f_r_334,0.344,"I am an Aquarius, but thank you for the points.
Thank to Yahoo Music for the two points."
4077,f_r,f_r_53,0.344,"You should find another one, for at least five years.
I bet I found him at least five times."
4078,stance,stance_530,0.344,"@AnneJp1946 I have no problem with birth control but their you go with that free thing again. So your solution is murder good idea
RT @spicysandwich: Say it again for me one time! Anti-abortion laws only lead to unsafe, illegal abortions!"
4079,stance,stance_183,0.344,"#HillaryDebateQuestion So you profess admiration for #MargaretSanger who wanted to rid the country of ""negros"". Explain please?
Night, sleep tight, don't let Hillary bite. says @Tony_Tickets ""Nightmares"" is all I say."
4080,snli,snli_504,0.344,"A dog lying on its back in the sand.
A young boy stands near a sand pyramid."
4081,snli,snli_21,0.344,"A man in a gray shirt is walking next to a concrete wall.
a little baby skateboarding on a small concrete wall"
4082,stance,stance_728,0.344,"Both Democrats and #IslamicState murder by dismemberment. The only difference is the age of their victims. #ISIS
@nytimes Thanks to anti-choicers, women dealing with this may also face prosecution."
4083,gr,gr_178,0.344,"He doesn't give up on her after ALL the things she does that jeopardizes them.
From cutting Jude to prove if he was a rogue(which he wasn't), to keeping secrets from Damen so he doesn't lose his patience with her."
4084,gr,gr_501,0.344,"Perhaps a bit of Sage advice is in order, but I'll leave that to Jaron!
Jaron Sage learns a lot in this book, actually--especially how to see other people's feelings, and how to better share his own."
4085,stance,stance_12,0.344,"If you want #Equality then let ALL the babies live!!
@ghhshirley Charged with Manslaughter After Another Woman Dies From"
4086,gr,gr_98,0.344,"I think this one was better than the first one, but it could be that I was more used to the world that Kevin created.
It's wet my appetite for the next one."
4087,snli,snli_135,0.344,"A man walking down the pier scratching his back with a boat sailing in the background as the sun sets over the water.
A huge cruise liner covers the horizon from a beach with beautiful clear water."
4088,stance,stance_545,0.344,"Hillary has lied, deleted Benghazi emails, and betrayed the trust of Americans scandal after scandal.
Getting another @HillaryClinton bumper sticker because #LoveWins and 2 just wasn't enough"
4089,stance,stance_432,0.344,"297 days until I can register to vote!!1 year 193 days until Election Day #RockTheVote #democrats #everyvotecounts
If you're not watching @HillaryClinton's speech right now you're missing her drop tons of wisdom."
