Index,DocID,PairID,Score,Text
1431,snli,snli_628,0.6559999999999999,"A man by himself fishing in a river that runs through a city.
A male is standing in a river and fishing and is holding a net."
1432,sts,sts_60,0.6559999999999999,"A woman is peeling a potato.
A woman is slicing a tomato."
1433,gr,gr_505,0.6559999999999999,"Cinder became Cinderella and poor Ella became nonexistent to her mother.
A clever twist on the classic Cinderella story."
1434,gr,gr_793,0.6559999999999999,"I need more Izzy, Dex, and Romy!
I also really liked DEX, Izzy, Anderson, and Romy."
1435,w_pp,w_pp_175,0.6559999999999999,"The town of Dobele has a Cultural Centre as well as a museum .
Dobele is a town in Latvia with town rights since 1917 ."
1436,gr,gr_823,0.6559999999999999,"How does that make this fan fiction?
In my mind, it's fan fiction."
1437,w_pp,w_pp_133,0.6559999999999999,"Niagara Falls is divided into the Horseshoe Falls and the American Falls .
The Horseshoe Falls are the largest out of the three falls ."
1438,nmt_pp,nmt_pp_273,0.6559999999999999,"A dizzying abyss suddenly opens before me.
here it opens up a dizzying chasm."
1439,nmt_pp,nmt_pp_54,0.6559999999999999,"'Cause I'd tell you if I was.
because I would have told you if I had one."
1440,w_r,w_r_6,0.6559999999999999,"Even parodies of `` I Kissed a Girl '' are seeing chart success .
It 's not even half as good as Jill Sobule 's song ' I Kissed a Girl ' '' ."
1441,w_pp,w_pp_228,0.6559999999999999,"If there are dimensions to the thermodynamic space , then there are unique thermodynamic potentials .
In thermodynamics , thermodynamic potentials are parameters associated with a thermodynamic system and have the dimensions of energy ."
1442,w_r,w_r_350,0.6559999999999999,"Its natural habitats are forest and woodland , primarily humid .
Its natural habitats are subtropical or tropical moist montanes and rivers ."
1443,w_pp,w_pp_455,0.6559999999999999,"Several battalions are grouped to form a regiment or a brigade .
More that one battalions are often make up a regiment or a brigade ."
1444,snli,snli_464,0.6559999999999999,"Man looking at a computer screen in a lab coat.
Man with goatee looking at a computer screen."
1445,sts,sts_136,0.6559999999999999,"The venture owns five oil refineries and more than 2,100 filling stations in Russia and Ukraine.
TNK-BP has six oil producing units, five refineries and 2,100 filling stations."
1446,gr,gr_800,0.6559999999999999,"And most recently, The Dreadful Tale of Prosper Redding came along.
The Dreadful Tale of Prosper Redding is perfect for this time of year!"
1447,gr,gr_953,0.6559999999999999,"Each story here has good balance of beautiful and dark messages.
Each story here has a beautiful message."
1448,gr,gr_307,0.6559999999999999,"But i loved it and hope the final version is published!
I hope this book gets published soon cause i need to know what happens next!"
1449,snli,snli_420,0.6559999999999999,"a black and white colored dog jumping around in a body of water.
A dog is jumping over a stream of water on a sandy beach."
1450,f_r,f_r_189,0.6559999999999999,"it is file sharing by the way.
If you use a file sharing program..."
1451,nmt_pp,nmt_pp_233,0.6559999999999999,"The brewery is renowned for its dark, strong beers.
in particular, the production of strong dark beer was known."
1452,w_pp,w_pp_77,0.6559999999999999,"A laboratory is a facility that provides controlled conditions in which scientific research , experiments , and measurement may be performed .
A laboratory is a work place where scientific research , experiments , or measurement are done ."
1453,sts,sts_77,0.6559999999999999,"Brazilian leader holds crisis talks on street protests
Brazil leader promises reform vote"
1454,w_r,w_r_322,0.6559999999999999,"Joshua Bell made his Carnegie Hall debut in 1985 with the Saint Louis Symphony Orchestra .
In 1930 , Szell made his United States debut with the Saint Louis Symphony Orchestra ."
1455,w_r,w_r_485,0.6559999999999999,"Nilo Murtinho Braga , best known as Nilo was a Brazilian footballer in forward striker role .
Manuel Marinho Alves , best known as Maneca was a Brazilian footballer in striker role ."
1456,sts,sts_44,0.6559999999999999,"Putin 'Wins Russian Presidential Election'
Polls open in Russian presidential election"
1457,snli,snli_344,0.6559999999999999,"young man sleeping in chair inside large study room
A man with a beard sleeps in a chair, computer banks behind him."
1458,sts,sts_187,0.6559999999999999,"As others have said, ""ten of six"", though not used in many English speaking areas, would be understood as 5:50.
Ten of six"" probably means 5:50 but I have not heard it before."
1459,w_pp,w_pp_239,0.6559999999999999,"Billy Graham has conducted many evangelistic crusades since 1948 .
He has been to over 41 evangelistic crusades since 1948 ."
1460,nmt_pp,nmt_pp_407,0.6559999999999999,"What's that expression? feeling good about the economy.
how to express it? Good feeling is of economics."
1461,w_r,w_r_406,0.6559999999999999,"It was named in August 2003 , from Norse mythology , where Ymir is the ancestor of all the Jotuns or frost giants .
It was named in August 2003 from Norse mythology , where Suttung is a Jotun or giant who once owned the mead of poetry ."
1462,gr,gr_874,0.6559999999999999,"Jennifer L. Armentrout may be one of my most favorite new authors!!
It's a jennifer l armentrout book, so of course i'd love it!!"
1463,nmt_pp,nmt_pp_381,0.6559999999999999,"It swept out like lightning, flash after flash.
the glint behind the flash of lightning flashed."
1464,w_pp,w_pp_4,0.6559999999999999,"When Stanwyck 's film career declined in 1957 , she moved to television .
Barbara Stanwyck was an American actress of film , stage , and television ."
1465,nmt_pp,nmt_pp_259,0.6559999999999999,"Even the windows are blown from neighborhood buildings
surrounding buildings are damaged, the windows of the surrounding buildings are broken."
1466,w_r,w_r_77,0.6559999999999999,"Stream ciphers represent a different approach to symmetric encryption from block ciphers .
In modern cryptography , symmetric key ciphers are generally divided into stream ciphers and block ciphers ."
1467,f_r,f_r_234,0.6559999999999999,"I love a guy who makes me laugh alot.
Give him a smile or do something which makes her laugh at you."
1468,gr,gr_457,0.6559999999999999,"Yara, & Treygan are awesome characters that I couldn't get enough of.
Yara got on my nerves for about the first third of the book."
1469,f_r,f_r_523,0.6559999999999999,"You can go to www.bearshare.com to teach for and download songs.
You visit the www.bearshare.com or the www.limewire.com websites, then you download."
1470,snli,snli_72,0.6559999999999999,"Two dogs wrestle in the grass with a chain link fence in the background.
A long-haired black and brown dog runs through the grass."
1471,nmt_pp,nmt_pp_215,0.6559999999999999,"The birth was a difficult one, and it left the countess unable to conceive.
the countess had a difficult birth, and she couldn't bear any more."
1472,gr,gr_461,0.6559999999999999,"He and Despina have the funniest and wittiest interactions.
This made me love Despina so much more than I did already."
1473,w_pp,w_pp_278,0.6559999999999999,"The Opel Sintra is a large MPV manufactured by General Motors for the European market between 1996 and 1999 .
The Opel/Vauxhall Sintra is an Large MPV produced by Opel from 1996 to 2000 ."
1474,gr,gr_207,0.6559999999999999,"I didn't connect with the story and the parts that were supposed to be exciting just didn't do it for me.
it didn't focus much on the love story but the part when each exposed their feelings was something, felt it all the way thru."
1475,gr,gr_600,0.6559999999999999,"Glenn is a conflicted heroine, forced to negotiate between her own agenda and the tasks that circumstance have forced upon her.
It isn't a perfect world, but it's endured, much like Glenn and her father have in their own small way."
1476,gr,gr_882,0.6559999999999999,"The story becomes a retelling of Sleeping Beauty.
A retelling of the Sleeping Beauty fairy tale with a Russian twist."
1477,w_pp,w_pp_374,0.6559999999999999,"On January 31 , 2007 Michael Dell returned to the company as CEO .
It is named after Michael Dell , the CEO and creator of the company ."
1478,gr,gr_806,0.6559999999999999,"If you love Fallon and Jeff you've got to read this.
I loved reading more about Jeff and Fallon."
1479,w_r,w_r_202,0.6559999999999999,"He named his fragrance Eau de Cologne , in honor of his new hometown .
Eau de Cologne , or just `` cologne '' , has now become a generic term ."
1480,w_r,w_r_289,0.6559999999999999,"It is a junction station with a disused branch line to Naushahro Feroze .
Naushahro Feroze , is town in Naushahro Feroze district , Sindh , Pakistan ."
1481,stance,stance_440,0.6559999999999999,"I don't plan on ever having an abortion, but here's the thing ...I don't think anyone ever PLANS on it.
Dear #BristolPalin. STOP. Just FUCKING STOP. You have choices. It's called #abortion. Take it or leave it but quit whining. #fem2"
1482,snli,snli_503,0.6559999999999999,"little girl in pink dress running in grass
A little girl sits in a grassy field with a doll at her side."
1483,w_r,w_r_163,0.6559999999999999,"A tropical wave that moved off the African coast formed into a tropical depression 300 n mi southeast of Cape Verde on August 19 .
A tropical wave off the coast of Africa organized into Tropical Depression Seven on September 7 while near the Cape Verde islands ."
1484,nmt_pp,nmt_pp_45,0.6559999999999999,"Subsidies: data detailing subsidies received during the accounting year by the holding.
subsidy: The subsidy obtained by the undertaking during the financial year."
1485,nmt_r,nmt_r_251,0.6559999999999999,"the temperature dropped, as well as the temperature of my heart.
The temperature dropped two or three degrees."
1486,w_r,w_r_72,0.6559999999999999,"Apple incorporated several features in the design of the MacBook Air to make it more environmentally friendly .
When the MacBook Air was introduced , Apple described it as the `` world 's thinnest notebook '' ."
1487,w_pp,w_pp_146,0.6559999999999999,"Underfloor radiant heating has long been widespread in China and Korea .
The most common kind of radiant heating is underfloor heating ."
1488,snli,snli_370,0.6559999999999999,"a woman drinks a beer as a man shows her something on his laptop
A woman with blond-hair is sitting in a booth with a drink working on her laptop."
1489,gr,gr_337,0.6559999999999999,"Geared toward the ""tween"" set, it is still enjoyable for adults.
Even though I'm not the target audience (young adults) for this book, I enjoyed it immensely."
1490,nmt_pp,nmt_pp_403,0.6559999999999999,"He might be at the Stardust next year
maybe in Rivie next year, maybe in Stardust."
1491,gr,gr_771,0.6559999999999999,"Nice girls Don't Date Date men is funnier than the first book in the series (Nice Girls Don't Have Fangs).
I really enjoyed the pop culture reference lovin Jane Jameson in Nice Girls Don't Date Dead Men."
1492,nmt_pp,nmt_pp_244,0.6559999999999999,"Let me at least be burned with it.
I wish he would at least burn me."
1493,gr,gr_932,0.6559999999999999,"But The Evolution of Mara Dyer proved me wrong.
With The Evolution of Mara Dyer, thankfully, the romance is dialed down a lot."
1494,stance,stance_573,0.6559999999999999,"We need someine to bring this country back to life! @realDonaldTrump resuscitate America!
I'm voting for Donald Trump this election #waitonit"
1495,snli,snli_107,0.6559999999999999,"A man in black is taking a jump on a snowboard.
A snowboard rider jumping high on his snowboard in the snow."
1496,gr,gr_776,0.6559999999999999,"The science fiction 'breeder' type book.
It is a beautiful mix of science fiction, paranormal and romance."
1497,gr,gr_927,0.6559999999999999,"I love the addition of Maud and Helen.
Having Maud and Helen reenter Dina's life was one of the best parts about the story."
1498,nmt_pp,nmt_pp_23,0.6559999999999999,"She is a mighty enchantress, is she?
it's a powerful incantation and sorceress, isn't it?"
1499,w_pp,w_pp_198,0.6559999999999999,"There are also two cities in North Yorkshire .
Towns in North Yorkshire , England , UK ."
1500,gr,gr_413,0.6559999999999999,"Reading it made me realise why Terry Pratchett is one of the most read authors.
Pratchett is hilarious, though; I found myself audibly laughing many times while reading this."
1501,gr,gr_934,0.6559999999999999,"While Korum is the dominate, Mia knows how to fight him for what she wants.
However, there are instances where the relationship between Korum and Mia becomes very male dominant."
1502,gr,gr_895,0.6559999999999999,"I really enjoyed this book from Edwards prospective.
Twilight from Edward's perspective, sure to be a guilty pleasure."
1503,gr,gr_453,0.6559999999999999,"If you enjoy Young Adult Paranormal books, this is a pretty great choice for you.
I recommend this book especially if you enjoyed movies like ""The Craft""."
1504,snli,snli_716,0.6559999999999999,"A man and a child are at the water's edge.
A man and a woman sitting on a ledge close to a body of water."
1505,gr,gr_669,0.6559999999999999,"However, Kate Messner could have not written it any more accurately than she did.
THE SEVENTH WISH by Kate Messner blends everyday life with a wish-giving fish."
1506,w_pp,w_pp_134,0.6559999999999999,"The Qingzang railway linking the region to Qinghai in China proper was opened in 2006 .
A railway line , the Qingzang railway , has been built , linking China to Lhasa ."
1507,stance,stance_146,0.6559999999999999,"@HillaryClinton You have proven your dishonesty once again in flip flopping on this issue. People know you were opposed before.
#HILLARY has been lying for so long that her first fib was in morse code #HillNo2016"
1508,gr,gr_217,0.6559999999999999,"Last March 3, I had the chance to meet Tahere Mafi and Ransom Riggs.
As good if not better than the 1st one and Tahereh Mafi .. Oh Tahereh Mafi is my queen."
1509,w_r,w_r_117,0.6559999999999999,"Tropical Depression Seven formed from a tropical wave on September 7 .
Tropical Depression 14 formed from a tropical wave on October 14 ."
1510,stance,stance_491,0.6559999999999999,"People: Donald Trump is a man who can lead this country into the future.
@realDonaldTrump Sir, i just want you to know that you'll be the greatest President of this Generation!"
1511,f_r,f_r_78,0.6559999999999999,"You can search on the website ""Youtube
Why not search for some information on their website?"
1512,f_pp,f_pp_253,0.6559999999999999,"MULLINSKY IS A FALL GUY, HE TAKES LOTS OF RISKS AND HAS A LOT OF MONEY
Lots of money, often with lots of risks Mullinsky - A fall guy."
1513,gr,gr_496,0.6559999999999999,"I particularly love the detail provided about faery existence, breeding and storytelling.
I loved the faery expressions; one in particular stuck out as very clever: ""That's a very heavy acorn for such a little twig."
1514,w_pp,w_pp_461,0.6559999999999999,"The law of Charlemagne was based on Salic Law , an influence as great as that of Greece and Rome .
It stayed important in parts of western Europe for a long time because Charlemagne based his laws on the Salic law ."
1515,gr,gr_847,0.6559999999999999,"When Connor is attacked by Cabhan it puts Meara completely of her stride.
This is the story of Connor O'Dwyer and Meara Quinn."
1516,f_r,f_r_54,0.6559999999999999,"is there really lust at 1st sight?
I believe in lust at first sight, but love?"
1517,f_r,f_r_214,0.6559999999999999,"You ask him to leave his wife and he teases you?
He obviously loves his wife and has no plans to leave her."
1518,f_r,f_r_115,0.6559999999999999,"You should leave if you are there for your children.
Then, hurry up and leave quickly, and do not forget the children!"
1519,w_pp,w_pp_32,0.6559999999999999,"He recorded for Chess in 1950 , and was once again denied release .
He later recorded for Chess was still the music was never released ."
1520,gr,gr_979,0.6559999999999999,"The Gist Daisy Giordano is the odd one out in her family.
Daisy Giordano is the only ""norm"" in a family of psychics."
1521,w_r,w_r_0,0.6559999999999999,"This template converts ONS codes to population , rank & density for Scottish councils .
This template converts ONS codes to political control for Scottish councils ."
1522,w_r,w_r_201,0.6559999999999999,"He was the son of Nicolas Desmarest .
Desmarest was born at Soulaines , in the department of Aube ."
1523,gr,gr_644,0.6559999999999999,"I know this review is super short, but what can I say.
A short review for a short novella."
1524,w_pp,w_pp_250,0.6559999999999999,"His parents were Queen Jeanne III and King Antoine of Navarre .
He was the son of Antoine de Bourbon and Jeanne of Navarre ."
1525,w_pp,w_pp_182,0.6559999999999999,"UNO 's athletic teams participate in the Sun Belt Conference .
The schools teams are a part of the Sun Belt Conference ."
1526,sts,sts_119,0.6559999999999999,"the problem isn't who has money.
the problem is who doesn't have money."
1527,sts,sts_143,0.6559999999999999,"The blue-chip Dow Jones industrial average .DJI climbed 164 points, or 1.91 percent, to 8,765.38, brushing its highest levels since mid-January.
The blue-chip Dow Jones industrial average .DJI tacked on 97 points, or 1.14 percent, to 8,699."
1528,gr,gr_894,0.6559999999999999,"The Elementals is more of a southern gothic horror novel more than straight up spooks.
Southern Gothic at it's best !"
1529,stance,stance_398,0.6559999999999999,"I'm voting for Donald Trump this election #waitonit
@realDonaldTrump Some people just want to be president. Others want to MAKE AMERICA GREAT AGAIN!"
1530,f_pp,f_pp_75,0.6559999999999999,"If that event occurs, I do know where I want to move to.
If it does I know where I'm moving."
1531,nmt_pp,nmt_pp_39,0.6559999999999999,"Hitting Jacen harder than the jolt from the explosion was Jaina's shocked anguish.
before the aftershock, he was struck by Jacena Jainin's shock and pain."
1532,gr,gr_915,0.6559999999999999,"So good to have more adventures with Hadrian and Royce.
- We see too little of Royce and Hadrian."
1533,f_r,f_r_173,0.6559999999999999,"the clitoris and nipples because they are the most sensitive
Some women have very sensitive nipples and some don't."
1534,snli,snli_320,0.6559999999999999,"Children in blue shirts do homework around a large table.
Nine kids sit at a table, doing homework."
1535,w_r,w_r_287,0.6559999999999999,"Bruno Walter was a German-born conductor and composer .
Ludwig von Brenner was a German conductor and composer ."
1536,nmt_pp,nmt_pp_415,0.6559999999999999,"Oh, five to seven days for the 'A' group.
by A Group in about seven days."
1537,nmt_pp,nmt_pp_286,0.6559999999999999,"A bicycle is incompletely hidden in the weeds at the side of the road.
in the grasses by the road, he connected the hidden bicycle."
1538,f_r,f_r_582,0.6559999999999999,"Just ask her and be confident.
Be confident - but not cocky."
1539,f_r,f_r_625,0.6559999999999999,"Www.imdb.com is an excellent place to confirm that information.
For more information on Robyn Rihanna Fenty, go to www.imdb.com."
1540,gr,gr_434,0.6559999999999999,"I enjoyed the story for the most part, but way too much time was spent dwelling on Mare as a prisoner.
Can Mare escape her imprisonment before time runs out?"
1541,f_r,f_r_296,0.6559999999999999,"You like that song dear Mamma by Tupac.
Copy the song 'Dear Mother' by Tupac."
1542,nmt_pp,nmt_pp_16,0.6559999999999999,"Have you ever heard of Arne & Carlos ?
did you hear about Arlo and Karlos?"
1543,w_r,w_r_177,0.6559999999999999,"The episode aired on December 5 , 1991 .
The episode aired on January 10 , 1991 ."
1544,gr,gr_290,0.6559999999999999,"Beauty and the Beast is my favorite fairy tale, and I still fully enjoyed Robin McKinley's retelling of it.
Of course the Beast and Beauty end up falling in love, but I'm not entirely sure why."
1545,gr,gr_686,0.639,"There was something otherworldly in Amy Harmon's simple yet eloquent, lyrical writing.
Once more, Amy Harmon enchanted me with her incredible talent."
1546,snli,snli_127,0.633,"A young child in a stroller wearing a green jacket.
a blond child is sleeping in a stroller."
1547,gr,gr_469,0.633,"Many characters in the beast role have very little contributing the the beast aspect.
It's a really different take on the Beauty & the Beast story; with a great introduction to the main characters."
1548,snli,snli_444,0.633,"A child kicks a soccer ball.
A kid sitting on a soccer ball at the park."
1549,gr,gr_275,0.633,"But my favourite part of that series was Ridley Duchannes.
I felt like I was reading about a weak, confused, love sick character who just happened to be named Ridley."
1550,w_pp,w_pp_329,0.633,"She is credited with starting Israel 's annual Hebrew Book Week .
She starting the Annual Hebrew Book Week in 1926 ."
1551,w_pp,w_pp_211,0.633,"In physics , Compton scattering is a type of scattering that X-rays and gamma rays undergo in matter .
This scattering is one of the main things that happen when gamma rays meet matter ."
1552,f_r,f_r_73,0.633,"On average, I'd say once or twice a week, sometimes more.
More or Less that once or twice a week. It depends on the couple."
1553,f_r,f_r_315,0.633,"Try to get areas, or limewire. Things like that are free.
The music on limewire is free but it is against the law."
1554,nmt_pp,nmt_pp_433,0.633,"From there, and from a billion other worlds Dust flows.
the dust flows out of billions of worlds."
1555,nmt_r,nmt_r_190,0.633,"a gate began to open in front of the coach.
After removing the padlock, she pushed the gate open."
1556,nmt_r,nmt_r_231,0.633,"since other solutions would not enable the objectives pursued, the best legal instrument is the Regulation.
As regards the legislative form of the instrument, a Regulation appears as the most appropriate taking into account both the problems and objectives identified."
1557,w_pp,w_pp_416,0.625,"He sometimes includes North Africa in his definition of Eurasia .
Sometimes Eurasia is divided into West Eurasia and East Eurasia ."
1558,sts,sts_82,0.625,"A black dog wearing an orange collar is entangled with fishing wire.
The black dog wearing a red collar shakes water off."
1559,f_r,f_r_187,0.625,"Go to see the movie Memoirs of a Geisha, it is a beautiful movie.
I just took my girlfriend to see the movie Memoirs of a Geisha."
1560,gr,gr_387,0.625,"That was really the biggest downfall of this for me and the reason I had to give it only a 3.5 stars.
** spoiler alert ** (3.5 Stars) Spoilers shall abound."
1561,gr,gr_684,0.625,"It's a struggle sometimes to find an easy, light paranormal romance.
The start of a nice paranormal romance series."
1562,snli,snli_574,0.625,"A child sits on top of a large tree stump.
A man and a woman are relaxing with a child among the trees."
1563,w_pp,w_pp_17,0.625,"Argentina claimed South Georgia in 1927 , and the South Sandwich Islands in 1938 .
South Georgia and South Sandwich Islands are an overseas territory of the United Kingdom claimed by Argentina ."
1564,stance,stance_264,0.625,"@realDonaldTrump: We have got to take our country back. It's time! Win it Mr. Trump
just want to give a big #shoutout to my #1 man these days, @realDonaldTrump Get 'er done, big guy!!"
1565,w_pp,w_pp_371,0.625,"This makes the Tipulidae the largest family of Diptera .
This means that the Tipulidae are the largest group of flies ."
1566,snli,snli_77,0.625,"Young lady in bikini lying on the beach
A woman in a bikini pulls a dog on a leash at the beach."
1567,snli,snli_718,0.625,"Two young ladies sitting on a bench eating ice cream cones.
A young girl in a blue shirt is eating an ice cream cone."
1568,gr,gr_906,0.625,"A nice, but rather light, sequel to the Curse of Chalion.
Enjoyed further exploration of the Chalion world."
1569,snli,snli_710,0.625,"Two older women working their spindles diligently.
Two old women enjoying at a gathering."
1570,snli,snli_69,0.625,"Three men riding horses in a rodeo.
Three people wrestle with a bull at a rodeo."
1571,w_pp,w_pp_466,0.625,"This is the actual color of the dye from the indigo plant when swatched onto raw fabric .
Indigo is a dye made from the indigo plant , used to dye cloth ."
1572,f_r,f_r_686,0.625,"Although it's sometimes hard not to, I never question fate.
Sometimes you have to takes a chance and allow fate to run its course."
1573,nmt_pp,nmt_pp_326,0.625,"Well, your phone and Ed's phone say otherwise.
all right, yours and Ed's phone call it something."
1574,snli,snli_142,0.625,"A group of people are eating together.
Two friends are eating at a cafe."
1575,w_pp,w_pp_48,0.625,"Vigoda was born in New York City , the son of Lena and Samuel Vigoda , Jewish immigrants from Russia .
In 1982 , People magazine said that Vigoda had died , even though he did not ."
1576,f_pp,f_pp_182,0.625,"Who asked if you ever had a girlfriend?
then when asked have you ever even had a girlfriend, dude?"
1577,gr,gr_294,0.625,"I've waited through four books for their story, but trust me on this one, it was worth it!
I certainly didn't see the ending coming, but it has left me eagerly waiting for the next book."
1578,w_r,w_r_471,0.625,"Tackey & Tsubasa are a Japanese idol duo from Johnny & Associates .
SMAP is a Japanese idol group formed by Johnny & Associates ."
1579,f_r,f_r_172,0.625,"A t-shirt with Metallica's Master of Puppets on it.
Check out , Master of puppets coz' its supercool."
1580,w_r,w_r_123,0.625,"The primary lineup consisted of vocalist Roger Daltrey , guitarist Pete Townshend , bassist John Entwistle , and drummer Keith Moon .
The band 's line-up consists of vocalist Sonny Sandoval , drummer Wuv Bernardo , guitarist Marcos Curiel , and bassist Traa Daniels ."
1581,w_r,w_r_143,0.625,"His career in Formula One spanned 15 seasons , with his final two full seasons of top-level racing being spent in the CART series .
In his career , he has won 15 top-level doubles titles and $ 1,027,625 in prize money ."
